{
  "schemaVersion": "1.0.0",
  "id": "hermit",
  "contentVersion": 1,
  "arcana": "major",
  "majorArcanaNumber": 9,
  "tradition": "rider-waite-smith",
  "status": "published",
  "defaultLocale": "ja-JP",
  "name": {
    "ja-JP": "隠者"
  },
  "semanticAnchors": {
    "requiredThemeIds": [
      "solitary-inquiry",
      "inner-guidance",
      "earned-wisdom"
    ],
    "prohibitedThemeIds": [
      "permanent-isolation",
      "knowledge-hoarding"
    ]
  },
  "localizedContent": {
    "ja-JP": {
      "essence": "外の騒音から距離を取り、自分の経験を照らして本質を探す孤独と知恵。",
      "journeyStage": "達成や評価から一度離れ、旅の意味と次の方向を内側から問い直す段階。",
      "coreTension": "実りある孤独と、傷つくことを避ける孤立のあいだ。",
      "developmentalTask": "一人で考える時間を持ちながら、得た光を必要な場所へ持ち帰る。",
      "lightAspects": [
        "内省",
        "探求",
        "慎重さ",
        "経験から得た知恵"
      ],
      "shadowAspects": [
        "孤立",
        "閉鎖",
        "過度な慎重さ",
        "知識の独占"
      ],
      "upright": {
        "keywords": [
          "内省",
          "孤独",
          "探求",
          "導き"
        ],
        "core": "答えを多数決に求めず、経験を静かに検討する時間が必要である。",
        "advice": "期限を決めて外部刺激を減らし、自分が確かに知っていることを整理する。"
      },
      "reversed": {
        "allowedModes": [
          "excess",
          "blocked",
          "internalized"
        ],
        "keywords": [
          "孤立",
          "引きこもり",
          "迷走",
          "助言拒否"
        ],
        "core": "内省が深まっているのではなく、関係や決断から遠ざかる避難所になっている。",
        "advice": "一人で考える期限を決め、信頼できる一人へ途中経過を共有する。"
      },
      "contexts": {
        "work": {
          "focus": "専門性、調査、長期的な方向の再検討",
          "reflectionQuestion": "周囲の流行を除いたとき重要な問いは何か。"
        },
        "relationships": {
          "focus": "距離を取る必要と再接続の責任",
          "reflectionQuestion": "沈黙の目的と戻る時期を相手に伝えているか。"
        },
        "creativity": {
          "focus": "模倣から離れて固有の声を探すこと",
          "reflectionQuestion": "誰にも見せなくても続けたい表現は何か。"
        },
        "self": {
          "focus": "経験を知恵へ変える静かな時間",
          "reflectionQuestion": "最近の経験が繰り返し教えていることは何か。"
        }
      },
      "generationGuidance": {
        "preserve": [
          "限られた範囲を照らす光を含める",
          "孤独に目的と帰還可能性を持たせる"
        ],
        "avoid": [
          "人間嫌いや永久離脱だけにしない",
          "全員を見下す賢者として描かない"
        ],
        "visualMotifs": [
          "小さな灯り",
          "長い道または高所",
          "簡素な携行品",
          "闇の中の限られた視界"
        ]
      }
    }
  },
  "inheritancePolicy": {
    "coreEssenceRequired": true,
    "minimumRequiredThemeMatches": 1,
    "cardMayExtend": true,
    "cardMayContradict": false
  },
  "publication": {
    "publishedAt": "2026-07-19T00:00:00Z",
    "retiredAt": null
  }
}
